{
  "schemaVersion": "binrat.tool-manifest/1",
  "id": "build_case_diff-v1",
  "tool": "BUILD_CASE_DIFF",
  "authority": {
    "research": true,
    "network": false,
    "provider": false,
    "delivery": false,
    "capital": false
  },
  "effect": "DETERMINISTIC_FIXTURE_ONLY",
  "charge": {
    "toolCalls": 1,
    "modelCalls": 0,
    "costMicrousd": 0
  },
  "manifestDigest": "b81a4d08147e339231d195de1ade9a87dd56f6cf26434ba825f34dd817161001"
}
