{
  "schemaVersion": "binrat.tool-manifest/1",
  "id": "read_transfer_fixture-v1",
  "tool": "READ_TRANSFER_FIXTURE",
  "authority": {
    "research": true,
    "network": false,
    "provider": false,
    "delivery": false,
    "capital": false
  },
  "effect": "DETERMINISTIC_FIXTURE_ONLY",
  "charge": {
    "toolCalls": 1,
    "modelCalls": 0,
    "costMicrousd": 0
  },
  "manifestDigest": "de2e7eaa099e8ea4af50680e4324091f523b855f4ecd719d329138cb7148eb98"
}
