{
  "schemaVersion": "binrat.tool-manifest/1",
  "id": "decide_alert-v1",
  "tool": "DECIDE_ALERT",
  "authority": {
    "research": true,
    "network": false,
    "provider": false,
    "delivery": false,
    "capital": false
  },
  "effect": "DETERMINISTIC_FIXTURE_ONLY",
  "charge": {
    "toolCalls": 1,
    "modelCalls": 0,
    "costMicrousd": 0
  },
  "manifestDigest": "912176c863960ec2cf85c07849cc3250a210c5a9c25b581f7af80d59bcf0753d"
}
